{
  "schema_version": "0.3.0",
  "flow_id": "backend-mismatch-flow-001",
  "name": "Backend Mismatch Flow",
  "description": "Flow with mixed backends without bridge",
  "nodes": [
    {
      "id": "node-mne",
      "type": "optical_density",
      "category": "preprocessing",
      "position": {"x": 0, "y": 0},
      "config": {},
      "status": "ready",
      "ports": [
        {"name": "input", "direction": "in", "schema": "RawData", "required": true},
        {"name": "output", "direction": "out", "schema": "OpticalDensityData", "required": true}
      ],
      "backend_binding": {
        "backend_id": "mne_nirs",
        "operation": "optical_density"
      }
    },
    {
      "id": "node-cedalion",
      "type": "bandpass_filter",
      "category": "preprocessing",
      "position": {"x": 200, "y": 0},
      "config": {},
      "status": "ready",
      "ports": [
        {"name": "input", "direction": "in", "schema": "OpticalDensityData", "required": true},
        {"name": "output", "direction": "out", "schema": "OpticalDensityData", "required": true}
      ],
      "backend_binding": {
        "backend_id": "cedalion",
        "operation": "bandpass_filter"
      }
    }
  ],
  "edges": [
    {"id": "edge-1", "source": "node-mne", "target": "node-cedalion", "source_handle": "output", "target_handle": "input"}
  ],
  "adapter_registry": [],
  "metadata": {
    "created_at": "2026-01-01T00:00:00Z",
    "modified_at": "2026-01-01T00:00:00Z"
  }
}