{
  "schema_version": "0.2.0",
  "flow_id": "missing-metadata-flow-001",
  "name": "Missing Metadata Flow",
  "description": "A task scenario flow that omits required task atoms.",
  "nodes": [
    {
      "id": "node-data",
      "type": "dataset_discovery",
      "category": "data",
      "position": {"x": 0, "y": 0},
      "config": {"dataset_id": "test-dataset"},
      "status": "ready",
      "ports": [
        {"name": "out", "direction": "out", "schema": "DataManifest", "required": true}
      ]
    }
  ],
  "edges": [],
  "adapter_registry": [],
  "metadata": {
    "created_at": "2026-01-01T00:00:00Z",
    "modified_at": "2026-01-01T00:00:00Z"
  }
}
